{
  "schema_version": "humanoid.motion.v1",
  "coordinate_system": { "handedness": "right", "up_axis": "Y", "forward_axis": "Z", "units": "meters" },
  "fps": 8,
  "duration_seconds": 1.0,
  "skeleton": {
    "profile": "frameflow.humanoid.v1",
    "rotation_space": "parent",
    "quaternion_order": "xyzw",
    "bones": [
      "hips", "spine", "chest", "neck", "head",
      "leftShoulder", "leftUpperArm", "leftLowerArm", "leftHand",
      "rightShoulder", "rightUpperArm", "rightLowerArm", "rightHand",
      "leftUpperLeg", "leftLowerLeg", "leftFoot",
      "rightUpperLeg", "rightLowerLeg", "rightFoot"
    ]
  },
  "source": { "provider": "frameflow-fixture", "revision": "known-dance.v1" },
  "frames": [
    { "index": 0, "time": 0.0, "valid": true, "root": { "position": [0, 0, 0], "rotation": [0, 0, 0, 1], "confidence": 1 }, "bones": { "hips": { "rotation": [0, 0, 0, 1], "confidence": 1 }, "spine": { "rotation": [0, 0, 0, 1], "confidence": 1 }, "leftUpperArm": { "rotation": [0, 0, 0, 1], "confidence": 1 }, "rightUpperArm": { "rotation": [0, 0, 0, 1], "confidence": 1 }, "leftUpperLeg": { "rotation": [0, 0, 0, 1], "confidence": 1 }, "rightUpperLeg": { "rotation": [0, 0, 0, 1], "confidence": 1 } }, "contacts": { "leftFoot": { "active": true, "confidence": 1 }, "rightFoot": { "active": true, "confidence": 1 } } },
    { "index": 1, "time": 0.125, "valid": true, "root": { "position": [0.04, 0.02, 0], "rotation": [0, 0.0654031, 0, 0.9978589], "confidence": 1 }, "bones": { "hips": { "rotation": [0, 0.0654031, 0, 0.9978589], "confidence": 1 }, "spine": { "rotation": [0, 0, 0.0436194, 0.9990482], "confidence": 1 }, "leftUpperArm": { "rotation": [0, 0, 0.258819, 0.9659258], "confidence": 1 }, "rightUpperArm": { "rotation": [0, 0, -0.258819, 0.9659258], "confidence": 1 }, "leftUpperLeg": { "rotation": [0.1305262, 0, 0, 0.9914449], "confidence": 1 }, "rightUpperLeg": { "rotation": [-0.1305262, 0, 0, 0.9914449], "confidence": 1 } }, "contacts": { "leftFoot": { "active": false, "confidence": 0.2 }, "rightFoot": { "active": true, "confidence": 0.9 } } },
    { "index": 2, "time": 0.25, "valid": true, "root": { "position": [0.08, 0.05, 0.02], "rotation": [0, 0.1305262, 0, 0.9914449], "confidence": 1 }, "bones": { "hips": { "rotation": [0, 0.1305262, 0, 0.9914449], "confidence": 1 }, "spine": { "rotation": [0, 0, 0.0871557, 0.9961947], "confidence": 1 }, "leftUpperArm": { "rotation": [0, 0, 0.5, 0.8660254], "confidence": 1 }, "rightUpperArm": { "rotation": [0, 0, -0.5, 0.8660254], "confidence": 1 }, "leftUpperLeg": { "rotation": [0.258819, 0, 0, 0.9659258], "confidence": 1 }, "rightUpperLeg": { "rotation": [-0.258819, 0, 0, 0.9659258], "confidence": 1 } }, "contacts": { "leftFoot": { "active": false, "confidence": 0.1 }, "rightFoot": { "active": true, "confidence": 0.9 } } },
    { "index": 3, "time": 0.375, "valid": true, "root": { "position": [0.04, 0.02, 0.04], "rotation": [0, 0.0654031, 0, 0.9978589], "confidence": 1 }, "bones": { "hips": { "rotation": [0, 0.0654031, 0, 0.9978589], "confidence": 1 }, "spine": { "rotation": [0, 0, 0.0436194, 0.9990482], "confidence": 1 }, "leftUpperArm": { "rotation": [0, 0, 0.258819, 0.9659258], "confidence": 1 }, "rightUpperArm": { "rotation": [0, 0, -0.258819, 0.9659258], "confidence": 1 }, "leftUpperLeg": { "rotation": [0.1305262, 0, 0, 0.9914449], "confidence": 1 }, "rightUpperLeg": { "rotation": [-0.1305262, 0, 0, 0.9914449], "confidence": 1 } }, "contacts": { "leftFoot": { "active": true, "confidence": 0.9 }, "rightFoot": { "active": true, "confidence": 0.9 } } },
    { "index": 4, "time": 0.5, "valid": true, "root": { "position": [0, 0, 0.06], "rotation": [0, 0, 0, 1], "confidence": 1 }, "bones": { "hips": { "rotation": [0, 0, 0, 1], "confidence": 1 }, "spine": { "rotation": [0, 0, 0, 1], "confidence": 1 }, "leftUpperArm": { "rotation": [0, 0, 0, 1], "confidence": 1 }, "rightUpperArm": { "rotation": [0, 0, 0, 1], "confidence": 1 }, "leftUpperLeg": { "rotation": [0, 0, 0, 1], "confidence": 1 }, "rightUpperLeg": { "rotation": [0, 0, 0, 1], "confidence": 1 } }, "contacts": { "leftFoot": { "active": true, "confidence": 1 }, "rightFoot": { "active": true, "confidence": 1 } } },
    { "index": 5, "time": 0.625, "valid": true, "root": { "position": [-0.04, 0.02, 0.04], "rotation": [0, -0.0654031, 0, 0.9978589], "confidence": 1 }, "bones": { "hips": { "rotation": [0, -0.0654031, 0, 0.9978589], "confidence": 1 }, "spine": { "rotation": [0, 0, -0.0436194, 0.9990482], "confidence": 1 }, "leftUpperArm": { "rotation": [0, 0, -0.258819, 0.9659258], "confidence": 1 }, "rightUpperArm": { "rotation": [0, 0, 0.258819, 0.9659258], "confidence": 1 }, "leftUpperLeg": { "rotation": [-0.1305262, 0, 0, 0.9914449], "confidence": 1 }, "rightUpperLeg": { "rotation": [0.1305262, 0, 0, 0.9914449], "confidence": 1 } }, "contacts": { "leftFoot": { "active": true, "confidence": 0.9 }, "rightFoot": { "active": false, "confidence": 0.2 } } },
    { "index": 6, "time": 0.75, "valid": true, "root": { "position": [-0.08, 0.05, 0.02], "rotation": [0, -0.1305262, 0, 0.9914449], "confidence": 1 }, "bones": { "hips": { "rotation": [0, -0.1305262, 0, 0.9914449], "confidence": 1 }, "spine": { "rotation": [0, 0, -0.0871557, 0.9961947], "confidence": 1 }, "leftUpperArm": { "rotation": [0, 0, -0.5, 0.8660254], "confidence": 1 }, "rightUpperArm": { "rotation": [0, 0, 0.5, 0.8660254], "confidence": 1 }, "leftUpperLeg": { "rotation": [-0.258819, 0, 0, 0.9659258], "confidence": 1 }, "rightUpperLeg": { "rotation": [0.258819, 0, 0, 0.9659258], "confidence": 1 } }, "contacts": { "leftFoot": { "active": true, "confidence": 0.9 }, "rightFoot": { "active": false, "confidence": 0.1 } } },
    { "index": 7, "time": 0.875, "valid": true, "root": { "position": [-0.04, 0.02, 0], "rotation": [0, -0.0654031, 0, 0.9978589], "confidence": 1 }, "bones": { "hips": { "rotation": [0, -0.0654031, 0, 0.9978589], "confidence": 1 }, "spine": { "rotation": [0, 0, -0.0436194, 0.9990482], "confidence": 1 }, "leftUpperArm": { "rotation": [0, 0, -0.258819, 0.9659258], "confidence": 1 }, "rightUpperArm": { "rotation": [0, 0, 0.258819, 0.9659258], "confidence": 1 }, "leftUpperLeg": { "rotation": [-0.1305262, 0, 0, 0.9914449], "confidence": 1 }, "rightUpperLeg": { "rotation": [0.1305262, 0, 0, 0.9914449], "confidence": 1 } }, "contacts": { "leftFoot": { "active": true, "confidence": 0.9 }, "rightFoot": { "active": true, "confidence": 0.9 } } },
    { "index": 8, "time": 1.0, "valid": true, "root": { "position": [0, 0, 0], "rotation": [0, 0, 0, 1], "confidence": 1 }, "bones": { "hips": { "rotation": [0, 0, 0, 1], "confidence": 1 }, "spine": { "rotation": [0, 0, 0, 1], "confidence": 1 }, "leftUpperArm": { "rotation": [0, 0, 0, 1], "confidence": 1 }, "rightUpperArm": { "rotation": [0, 0, 0, 1], "confidence": 1 }, "leftUpperLeg": { "rotation": [0, 0, 0, 1], "confidence": 1 }, "rightUpperLeg": { "rotation": [0, 0, 0, 1], "confidence": 1 } }, "contacts": { "leftFoot": { "active": true, "confidence": 1 }, "rightFoot": { "active": true, "confidence": 1 } } }
  ],
  "metadata": { "fixture": true, "description": "One-second root sway with mirrored arm and leg motion." }
}
